{
 "step_id": "S14",
 "band": "L5",
 "packet_sha256": "sha256:40d8007a28ca2c8aeedae8ec15c91276d4f012fdb59f844cfe76f4cb91a73b4e",
 "author": {
  "host": "Claude Code desktop, in-session",
  "model": "claude-opus-5-5"
 },
 "attempt": 1,
 "intervals": [
  {
   "actor": "ugc_creator",
   "beats": [
    "b01"
   ],
   "effort": {
    "weight": "light",
    "time": "sustained",
    "space": "direct",
    "flow": "free"
   },
   "effort_action": "glide",
   "shape": {
    "quality": "advancing",
    "mode": "directional_spoke"
   },
   "space": {
    "kinesphere": "mid",
    "pathway": "central",
    "plane": "sagittal"
   },
   "intensity": 0.3,
   "effort_mode": "calm"
  },
  {
   "actor": "ugc_creator",
   "beats": [
    "b02",
    "b03"
   ],
   "effort": {
    "weight": "light",
    "time": "sustained",
    "space": "direct",
    "flow": "bound"
   },
   "effort_action": "glide",
   "shape": {
    "quality": "enclosing",
    "mode": "directional_arc"
   },
   "space": {
    "kinesphere": "near",
    "pathway": "central",
    "plane": "vertical"
   },
   "intensity": 0.4,
   "effort_mode": "trained"
  },
  {
   "actor": "ugc_creator",
   "beats": [
    "b04"
   ],
   "effort": {
    "weight": "light",
    "time": "sustained",
    "space": "indirect",
    "flow": "free"
   },
   "effort_action": "float",
   "shape": {
    "quality": "spreading",
    "mode": "shape_flow"
   },
   "space": {
    "kinesphere": "near",
    "pathway": "peripheral",
    "plane": "horizontal"
   },
   "intensity": 0.2,
   "effort_mode": "calm"
  }
 ]
}
